{
  "object_id": "obj_demo_form_test_ordering",
  "object_type": "pgo_form",
  "schema_version": "1.0.0",
  "revision": 1,
  "created_at": "2026-09-16T12:11:00Z",
  "created_by": "user_demo_001",
  "input_refs": [],
  "data": {
    "form_shape_id": "pgfs_test_ordering",
    "form_shape_version": "1.0.0",
    "fields": [
      {
        "key": "requested_at",
        "value": "2026-09-16T12:11:00Z"
      },
      {
        "key": "requested_by",
        "value": "user_demo_001"
      },
      {
        "key": "subject_id",
        "value": "subject_demo_001"
      },
      {
        "key": "patient_name",
        "value": "Alex Example"
      },
      {
        "key": "objective",
        "value": "Evaluate the synthetic three-gene demonstration"
      },
      {
        "key": "clinical_suspicion",
        "value": "Demo clinical hypothesis only"
      },
      {
        "key": "reference_id",
        "value": "PG_DEMO_REF_1"
      },
      {
        "key": "variant_classes",
        "value": [
          "SNV",
          "small_indel"
        ]
      },
      {
        "key": "required_output_types",
        "value": [
          "pgo_interactive_report",
          "pgo_pdf_report"
        ]
      },
      {
        "key": "patient_date_of_birth",
        "value": "1990-01-01"
      },
      {
        "key": "patient_identifier",
        "value": "PATIENT-DEMO-001"
      },
      {
        "key": "wet_lab_output_type",
        "value": "pgo_sequence_reads"
      },
      {
        "key": "required_profile",
        "value": "pg_demo_small_variant_v1"
      }
    ]
  },
  "files": []
}
