{
  "object_id": "obj_demo_form_final_report",
  "object_type": "pgo_form",
  "schema_version": "1.0.0",
  "revision": 1,
  "created_at": "2026-09-17T16:05:00Z",
  "created_by": "user_demo_001",
  "input_refs": [],
  "data": {
    "form_shape_id": "pgfs_final_report",
    "form_shape_version": "1.0.0",
    "fields": [
      {
        "key": "requested_at",
        "value": "2026-09-17T16:05:00Z"
      },
      {
        "key": "requested_by",
        "value": "user_demo_001"
      },
      {
        "key": "language",
        "value": "en"
      },
      {
        "key": "presentation",
        "value": "clinical"
      }
    ]
  },
  "files": []
}
