{
  "object_id": "obj_demo_form_form_to_pdf",
  "object_type": "pgo_form",
  "schema_version": "1.0.0",
  "revision": 1,
  "created_at": "2026-09-16T12:00:00Z",
  "created_by": "user_demo_001",
  "input_refs": [],
  "data": {
    "form_shape_id": "pgfs_form_to_pdf",
    "form_shape_version": "1.0.0",
    "fields": [
      {
        "key": "requested_at",
        "value": "2026-09-16T12:00:00Z"
      },
      {
        "key": "requested_by",
        "value": "user_demo_001"
      },
      {
        "key": "subject_id",
        "value": "subject_demo_001"
      },
      {
        "key": "patient_name",
        "value": "Alex Example"
      },
      {
        "key": "objective",
        "value": "Summarize the demonstration request"
      },
      {
        "key": "submitted_information",
        "value": [
          "Synthetic consultation note A",
          "Synthetic consultation note B"
        ]
      },
      {
        "key": "language",
        "value": "en"
      }
    ]
  },
  "files": []
}
