{
  "object_id": "obj_demo_form_informed_consent",
  "object_type": "pgo_form",
  "schema_version": "1.0.0",
  "revision": 1,
  "created_at": "2026-09-16T12:00:00Z",
  "created_by": "user_demo_001",
  "input_refs": [],
  "data": {
    "form_shape_id": "pgfs_informed_consent",
    "form_shape_version": "1.0.0",
    "fields": [
      {
        "key": "requested_at",
        "value": "2026-09-16T12:00:00Z"
      },
      {
        "key": "requested_by",
        "value": "user_demo_001"
      },
      {
        "key": "subject_id",
        "value": "subject_demo_001"
      },
      {
        "key": "signer_name",
        "value": "Alex Example"
      },
      {
        "key": "signer_capacity",
        "value": "self"
      },
      {
        "key": "consent_text_id",
        "value": "consent_demo_testing"
      },
      {
        "key": "consent_text_version",
        "value": "1.0.0"
      },
      {
        "key": "scope_description",
        "value": "Demo testing and processing for PGGENE_A, PGGENE_B and PGGENE_C"
      },
      {
        "key": "accepted",
        "value": true
      },
      {
        "key": "signature_evidence_id",
        "value": "signature_demo_001"
      }
    ]
  },
  "files": []
}
