{
  "object_id": "obj_demo_form_sample_transport",
  "object_type": "pgo_form",
  "schema_version": "1.0.0",
  "revision": 1,
  "created_at": "2026-09-16T12:35:00Z",
  "created_by": "user_demo_001",
  "input_refs": [],
  "data": {
    "form_shape_id": "pgfs_sample_transport",
    "form_shape_version": "1.0.0",
    "fields": [
      {
        "key": "requested_at",
        "value": "2026-09-16T12:35:00Z"
      },
      {
        "key": "requested_by",
        "value": "user_demo_001"
      },
      {
        "key": "contact_name",
        "value": "Example Contact"
      },
      {
        "key": "contact_phone",
        "value": "+54-DEMO-ONLY"
      }
    ]
  },
  "files": []
}
